{
  "schemaVersion": 1,
  "recordKind": "starPartyAstroSite",
  "id": "flagstaff-star-party",
  "displayName": "Flagstaff Star Party",
  "description": "The free Flagstaff Star Party brings public telescope viewing, night-sky orientations, music, and astronomy presentations to Buffalo Park in the world's first International Dark-Sky City.",
  "descriptionSources": [
    {
      "title": "Flagstaff Star Party official site",
      "url": "https://flagstaffstarparty.org/",
      "verifiedAt": "2026-09-06"
    }
  ],
  "astroSite": {
    "schemaVersion": 1,
    "sourceSiteID": "943cdec0-2ded-5c77-a37d-e7a431d62e21",
    "name": "Buffalo Park",
    "latitude": 35.222158,
    "longitude": -111.633222,
    "elevationMeters": 2115,
    "preferredPathPreviewCenterDirectionRaw": null
  },
  "location": {
    "venueName": "Buffalo Park",
    "locality": "Flagstaff",
    "region": "Arizona",
    "countryCode": "US",
    "countryName": "United States",
    "timezone": "America/Phoenix",
    "coordinateSource": {
      "title": "Coconino County Flagstaff Star Party event listing",
      "url": "https://www.coconino.az.gov/Calendar.aspx?EID=3273",
      "verifiedAt": "2026-09-06"
    }
  },
  "officialURLs": [
    {
      "role": "event",
      "url": "https://flagstaffstarparty.org/"
    },
    {
      "role": "local-tourism",
      "url": "https://www.flagstaffarizona.org/events/festivals/flagstaff-star-party/"
    }
  ],
  "media": {
    "hero": {
      "assetPath": "v1/assets/star-party-astrosites/flagstaff-star-party/hero.jpg",
      "sourceURL": "https://flagstaffstarparty.org/wp-content/uploads/2025/07/7R304973.1000w.jpg",
      "attribution": "Touring the sky in the Binocular Circle, via the Flagstaff Star Party official site.",
      "license": "No standalone image license stated",
      "permissionNotes": "Selected for AstroGuide presentation by the project owner on 2026-09-06; the Flagstaff Dark Skies Coalition and photographer retain applicable rights.",
      "verifiedAt": "2026-09-06"
    },
    "logo": {
      "assetPath": "v1/assets/star-party-astrosites/flagstaff-star-party/logo.png",
      "sourceURL": "https://flagstaffstarparty.org/wp-content/uploads/2025/07/FSP.CotN_.2020.blk_.png",
      "attribution": "Flagstaff Star Party and Celebration of the Night event mark via the official site.",
      "license": "No standalone image license stated",
      "permissionNotes": "Selected for AstroGuide presentation by the project owner on 2026-09-06; the Flagstaff Dark Skies Coalition and artwork creator retain applicable rights.",
      "verifiedAt": "2026-09-06"
    }
  },
  "events": [
    {
      "id": "flagstaff-star-party-2026",
      "name": "Flagstaff Star Party 2026",
      "start": "2026-10-01",
      "end": "2026-10-03",
      "status": "scheduled",
      "url": "https://flagstaffstarparty.org/",
      "source": {
        "title": "Flagstaff Star Party official site",
        "url": "https://flagstaffstarparty.org/",
        "verifiedAt": "2026-09-06"
      }
    }
  ]
}
